{
  "apiVersion": "containersagents.dev/v2alpha1",
  "kind": "Profile",
  "metadata": { "name": "customer-lab" },
  "spec": {
    "image": {
      "mode": "build",
      "repository": "localhost/containersagents-v2/customer-lab",
      "containerfile": "Containerfile",
      "context": ".",
      "pullPolicy": "newer"
    },
    "runtime": {
      "user": "agent", "uid": 1000, "gid": 1000,
      "home": "/home/agent", "workdir": "/workspace",
      "shell": ["/bin/bash", "--login"],
      "keepalive": ["sleep", "infinity"],
      "identityMode": "managed-user",
      "caBundle": "/etc/ssl/certs/ca-certificates.crt"
    },
    "defaults": {
      "securityClass": "development",
      "resourceClass": "balanced",
      "rootfsPersistence": "persistent"
    },
    "checks": [
      { "name": "shell", "command": ["/bin/bash", "--version"] }
    ]
  }
}
