{
  "apiVersion": "containersagents.dev/v2alpha1",
  "kind": "Profile",
  "metadata": { "name": "fedora-agent" },
  "spec": {
    "image": {
      "mode": "build",
      "repository": "localhost/containersagents-v2/fedora-agent",
      "containerfile": "Containerfile",
      "context": ".",
      "pullPolicy": "newer"
    },
    "runtime": {
      "user": "agent", "uid": 1000, "gid": 1000,
      "home": "/home/agent", "workdir": "/workspace",
      "shell": ["/bin/bash", "--login"],
      "keepalive": ["sleep", "infinity"],
      "identityMode": "managed-user", "allowSudo": true,
      "caBundle": "/etc/pki/tls/certs/ca-bundle.crt"
    },
    "features": ["common-cli", "python-development", "node-development"],
    "defaults": { "securityClass": "development", "resourceClass": "balanced", "rootfsPersistence": "persistent" },
    "minimumResources": { "memoryMiB": 1024, "cpus": 1, "pids": 512, "shmMiB": 128 },
    "checks": [
      { "name": "fedora", "command": ["cat", "/etc/fedora-release"] },
      { "name": "git", "command": ["git", "--version"] },
      { "name": "python", "command": ["python3", "--version"] }
    ]
  }
}
